PostgreSQL
PostgreSQL is an object-relational database management system (ORDBMS) 
Installed in Windows
#Show Databases

\l
                                         List of databases
   Name    |  Owner   | Encoding |      Collate       |       Ctype        |   Access privileges
-----------+----------+----------+--------------------+--------------------+-----------------------
 postgres  | postgres | UTF8     | English_India.1252 | English_India.1252 |
 template0 | postgres | UTF8     | English_India.1252 | English_India.1252 | =c/postgres          +
           |          |          |                    |                    | postgres=CTc/postgres
 template1 | postgres | UTF8     | English_India.1252 | English_India.1252 | =c/postgres          +
           |          |          |                    |                    | postgres=CTc/postgres
(3 rows)

postgres=# CREATE DATABASE TEST;
CREATE DATABASE

test-#
Here # shows I am Super User
test=>
" => " have rights to the database

# To see current date
SELECT current_date;
 current_date
--------------
 2022-03-31
(1 row)

# Running Arithmatic Commands
SELECT 2 + 2;
 ?column?
----------
        4
(1 row)

# \h for help
# \q to quit

# Postgre uses the SQL language
# "-- " to write comments in SQL

# Creating the tables in the databse

test1=# CREATE TABLE weather (
test1(#     city            varchar(80),
test1(#     temp_lo         int,           -- low temperature
test1(#     temp_hi         int,           -- high temperature
test1(#     prcp            real,          -- precipitation
test1(#     date            date
test1(# );
CREATE TABLE
test1=# CREATE TABLE cities (
test1(#     name            varchar(80),
test1(#     location        point
test1(# );
CREATE TABLE

# Deleteing the whole table  
test1=# DROP TABLE cities;
DROP TABLE


#inserting data in the tables
est1=# INSERT INTO weather VALUES ('San Francisco', 46, 50, 0.25, '1994-11-27');
INSERT 0 1
test1=# INSERT INTO cities VALUES ('San Francisco', '(-194.0, 53.0)');
INSERT 0 1
test1=# INSERT INTO weather (city, temp_lo, temp_hi, prcp, date)
test1-#     VALUES ('San Francisco', 43, 57, 0.0, '1994-11-29');
INSERT 0 1
test1=# INSERT INTO weather (date, city, temp_hi, temp_lo)
test1-#     VALUES ('1994-11-29', 'Hayward', 54, 37);
INSERT 0 1

# Quering the data from the to see data 
test1=# SELECT * FROM weather;
     city      | temp_lo | temp_hi | prcp |    date
---------------+---------+---------+------+------------
 San Francisco |      46 |      50 | 0.25 | 1994-11-27
 San Francisco |      43 |      57 |    0 | 1994-11-29
 Hayward       |      37 |      54 |      | 1994-11-29
(3 rows)

# Quesring data using Orerators to manipulate data 
test1=# SELECT city, (temp_hi+temp_lo)/2 AS temp_avg, date FROM weather;
     city      | temp_avg |    date
---------------+----------+------------
 San Francisco |       48 | 1994-11-27
 San Francisco |       50 | 1994-11-29
 Hayward       |       45 | 1994-11-29
(3 rows)

# Quering data with where clause to seespecific data

test1=# SELECT * FROM weather
test1-#     WHERE city = 'San Francisco' AND prcp > 0.0;
     city      | temp_lo | temp_hi | prcp |    date
---------------+---------+---------+------+------------
 San Francisco |      46 |      50 | 0.25 | 1994-11-27
(1 row)

# using orderby to arrandata while query it
test1=# SELECT * FROM weather
test1-#     ORDER BY city;
     city      | temp_lo | temp_hi | prcp |    date
---------------+---------+---------+------+------------
 Hayward       |      37 |      54 |      | 1994-11-29
 San Francisco |      46 |      50 | 0.25 | 1994-11-27
 San Francisco |      43 |      57 |    0 | 1994-11-29
(3 rows)


#query uniques data from the table 
test1=# SELECT DISTINCT city
test1-#     FROM weather;
     city
---------------
 Hayward
 San Francisco
(2 rows)

#Using Aggregate Functions MAX
test1=# SELECT max(temp_lo) FROM weather;
 max
-----
  46
(1 row)


test1=# SELECT city, max(temp_lo)
test1-#     FROM weather
test1-#     GROUP BY city;
     city      | max
---------------+-----
 Hayward       |  37
 San Francisco |  46
(2 rows)


test1=# UPDATE weather
test1-#     SET temp_hi = temp_hi - 2,  temp_lo = temp_lo - 2
test1-#     WHERE date > '1994-11-28';
UPDATE 2


#Manupulating the tables

#Deleting the specific data from the table

test1=# DELETE FROM weather WHERE city = 'Hayward';
DELETE 1

# updating the data in the table
test1=# UPDATE weather
test1-#     SET temp_hi = temp_hi - 2,  temp_lo = temp_lo - 2
test1-#     WHERE date > '1994-11-28';
UPDATE 2
test1=# SELECT * FROM weather;
     city      | temp_lo | temp_hi | prcp |    date
---------------+---------+---------+------+------------
 San Francisco |      46 |      50 | 0.25 | 1994-11-27
 San Francisco |      41 |      55 |    0 | 1994-11-29
(2 rows)

# Views in SQL are kind of virtual tables. A view also has rows and columns as they are in a real table in the database.

test1=# CREATE VIEW myview AS
test1-#     SELECT name, temp_lo, temp_hi, prcp, date, location
test1-#         FROM weather, cities
test1-#         WHERE city = name;
CREATE VIEW
test1=# SELECT * FROM myview;
     name      | temp_lo | temp_hi | prcp |    date    | location
---------------+---------+---------+------+------------+-----------
 San Francisco |      46 |      50 | 0.25 | 1994-11-27 | (-194,53)
 San Francisco |      41 |      55 |    0 | 1994-11-29 | (-194,53)
(2 rows)


# Foreign Keys -To maintain refrential integrity of data.
For Eg in above table if no data should be added in weather if there is no matching data in cities here we use foriegn keys so Postgresql can do this it self and mintain refrential integrity.

#create table cities with mane as primary key
 create table cities(
 name varchar(80) primary key,
 location point
 );
 ERROR:  relation "cities" already exists
 
 # and make refrence / foreign key of ctiries name column in weather table
 create table weather(
 city varchar(80) references cities(name),
 temp_lo int,
 temp_hi int,
 prcp real,
 date date
 );
 ERROR:  relation "weather" already exists
 # to describe table name
 \d tablename
 test1=# \d cities
                       Table "public.cities"
  Column  |         Type          | Collation | Nullable | Default
----------+-----------------------+-----------+----------+---------
 name     | character varying(80) |           |          |
 location | point                 |           |          |

# adding constrain to existing column in table
alter table cities add constraint cities_pk primary key(name);
ALTER TABLE
test1=# \d cities
                       Table "public.cities"
  Column  |         Type          | Collation | Nullable | Default
----------+-----------------------+-----------+----------+---------
 name     | character varying(80) |           | not null |
 location | point                 |           |          |
Indexes:
    "cities_pk" PRIMARY KEY, btree (name)
	
# Alter table to add foreign key constraints
alter table weather add constraint weather_pk foreign key (city) references cities(name);
ALTER TABLE

                      Table "public.weather"
 Column  |         Type          | Collation | Nullable | Default
---------+-----------------------+-----------+----------+---------
 city    | character varying(80) |           |          |
 temp_lo | integer               |           |          |
 temp_hi | integer               |           |          |
 prcp    | real                  |           |          |
 date    | date                  |           |          |
Foreign-key constraints:
    "weather_pk" FOREIGN KEY (city) REFERENCES cities(name)

#insert error due to Berkley not present in cities table
test1=# INSERT INTO weather VALUES ('Berkeley', 45, 53, 0.0, '1994-11-28');
ERROR:  insert or update on table "weather" violates foreign key constraint "weather_pk"
DETAIL:  Key (city)=(Berkeley) is not present in table "cities".


# Transactions
It is fundamental concept of Database systems.
It bundles multiple steps into one for all or nothing operation.
it help to provide atomicity propertty of datatbase ie if some failure occurs that prevents the transaction from completing, then none of the steps affect the database at all
A transactional database guarantees that all the updates made by a transaction are logged in permanent storage (i.e.,on disk) before the transaction is reported complete.
a transaction is set up by surrounding the SQL commands of the transaction with
BEGIN and COMMIT commands.
if in between donot want to complete transanction just issue command rollback
 A group of statements surrounded by BEGIN and COMMIT is sometimes
called a transaction block

Use "savepoint" and "rollback to" to control transaction inmore granural fashion.
 
